[
  {
    "date": "2026-01-01",
    "meals": [
      {
        "meal_type": "lunch",
        "time": "12:30",
        "foods": [
          "炒饭",
          "可乐"
        ],
        "estimated_calories": 800,
        "tags": [
          "外卖",
          "高碳水",
          "高油"
        ]
      },
      {
        "meal_type": "dinner",
        "time": "21:00",
        "foods": [
          "水煮鱼",
          "米饭"
        ],
        "estimated_calories": 750,
        "tags": [
          "外卖",
          "高油"
        ]
      }
    ],
    "daily_calories": 1550,
    "water_ml": 917
  },
  {
    "date": "2026-01-02",
    "meals": [
      {
        "meal_type": "breakfast",
        "time": "09:30",
        "foods": [
          "食堂馒头",
          "粥"
        ],
        "estimated_calories": 320,
        "tags": [
          "食堂",
          "简单"
        ]
      },
      {
        "meal_type": "lunch",
        "time": "13:00",
        "foods": [
          "米饭",
          "鸡腿",
          "青菜"
        ],
        "estimated_calories": 600,
        "tags": [
          "食堂",
          "简单"
        ]
      },
      {
        "meal_type": "dinner",
        "time": "20:00",
        "foods": [
          "水煮鱼",
          "米饭"
        ],
        "estimated_calories": 750,
        "tags": [
          "外卖",
          "高油"
        ]
      },
      {
        "meal_type": "snack",
        "time": "22:30",
        "foods": [
          "泡面"
        ],
        "estimated_calories": 400,
        "tags": [
          "便利店",
          "高碳水"
        ]
      }
    ],
    "daily_calories": 2070,
    "water_ml": 1042
  },
  {
    "date": "2026-01-03",
    "meals": [
      {
        "meal_type": "breakfast",
        "time": "09:30",
        "foods": [
          "面包",
          "牛奶"
        ],
        "estimated_calories": 300,
        "tags": [
          "便利店",
          "简单"
        ]
      },
      {
        "meal_type": "lunch",
        "time": "13:00",
        "foods": [
          "盖浇饭"
        ],
        "estimated_calories": 700,
        "tags": [
          "外卖",
          "高碳水"
        ]
      },
      {
        "meal_type": "dinner",
        "time": "19:30",
        "foods": [
          "食堂炒菜",
          "米饭"
        ],
        "estimated_calories": 580,
        "tags": [
          "食堂",
          "简单"
        ]
      }
    ],
    "daily_calories": 1580,
    "water_ml": 668
  },
  {
    "date": "2026-01-04",
    "meals": [
      {
        "meal_type": "breakfast",
        "time": "09:30",
        "foods": [
          "煎饼果子"
        ],
        "estimated_calories": 400,
        "tags": [
          "路边摊",
          "高碳水",
          "高油"
        ]
      },
      {
        "meal_type": "lunch",
        "time": "12:00",
        "foods": [
          "米饭",
          "鸡腿",
          "青菜"
        ],
        "estimated_calories": 600,
        "tags": [
          "食堂",
          "简单"
        ]
      },
      {
        "meal_type": "dinner",
        "time": "19:00",
        "foods": [
          "食堂炒菜",
          "米饭"
        ],
        "estimated_calories": 580,
        "tags": [
          "食堂",
          "简单"
        ]
      }
    ],
    "daily_calories": 1580,
    "water_ml": 896
  },
  {
    "date": "2026-01-05",
    "meals": [
      {
        "meal_type": "lunch",
        "time": "12:00",
        "foods": [
          "黄焖鸡米饭"
        ],
        "estimated_calories": 750,
        "tags": [
          "外卖",
          "高油",
          "高碳水"
        ]
      },
      {
        "meal_type": "dinner",
        "time": "19:00",
        "foods": [
          "食堂炒菜",
          "米饭"
        ],
        "estimated_calories": 580,
        "tags": [
          "食堂",
          "简单"
        ]
      }
    ],
    "daily_calories": 1330,
    "water_ml": 1047
  },
  {
    "date": "2026-01-06",
    "meals": [
      {
        "meal_type": "breakfast",
        "time": "09:30",
        "foods": [
          "面包",
          "牛奶"
        ],
        "estimated_calories": 300,
        "tags": [
          "便利店",
          "简单"
        ]
      },
      {
        "meal_type": "lunch",
        "time": "12:00",
        "foods": [
          "盖浇饭"
        ],
        "estimated_calories": 700,
        "tags": [
          "外卖",
          "高碳水"
        ]
      },
      {
        "meal_type": "dinner",
        "time": "20:00",
        "foods": [
          "水煮鱼",
          "米饭"
        ],
        "estimated_calories": 750,
        "tags": [
          "外卖",
          "高油"
        ]
      }
    ],
    "daily_calories": 1750,
    "water_ml": 933
  },
  {
    "date": "2026-01-07",
    "meals": [
      {
        "meal_type": "lunch",
        "time": "12:00",
        "foods": [
          "盖浇饭"
        ],
        "estimated_calories": 700,
        "tags": [
          "外卖",
          "高碳水"
        ]
      },
      {
        "meal_type": "dinner",
        "time": "19:30",
        "foods": [
          "麻辣香锅"
        ],
        "estimated_calories": 800,
        "tags": [
          "外卖",
          "高油"
        ]
      }
    ],
    "daily_calories": 1500,
    "water_ml": 1155
  },
  {
    "date": "2026-01-08",
    "meals": [
      {
        "meal_type": "lunch",
        "time": "13:00",
        "foods": [
          "面条",
          "卤蛋"
        ],
        "estimated_calories": 550,
        "tags": [
          "食堂",
          "简单"
        ]
      },
      {
        "meal_type": "dinner",
        "time": "19:30",
        "foods": [
          "炸鸡",
          "薯条",
          "可乐"
        ],
        "estimated_calories": 900,
        "tags": [
          "外卖",
          "高油",
          "高碳水"
        ]
      }
    ],
    "daily_calories": 1450,
    "water_ml": 668
  },
  {
    "date": "2026-01-09",
    "meals": [
      {
        "meal_type": "lunch",
        "time": "13:00",
        "foods": [
          "盖浇饭"
        ],
        "estimated_calories": 700,
        "tags": [
          "外卖",
          "高碳水"
        ]
      },
      {
        "meal_type": "dinner",
        "time": "21:00",
        "foods": [
          "麻辣香锅"
        ],
        "estimated_calories": 800,
        "tags": [
          "外卖",
          "高油"
        ]
      },
      {
        "meal_type": "snack",
        "time": "23:30",
        "foods": [
          "奶茶"
        ],
        "estimated_calories": 300,
        "tags": [
          "外卖"
        ]
      }
    ],
    "daily_calories": 1800,
    "water_ml": 944
  },
  {
    "date": "2026-01-10",
    "meals": [
      {
        "meal_type": "breakfast",
        "time": "08:30",
        "foods": [
          "食堂馒头",
          "粥"
        ],
        "estimated_calories": 320,
        "tags": [
          "食堂",
          "简单"
        ]
      },
      {
        "meal_type": "lunch",
        "time": "12:00",
        "foods": [
          "螺蛳粉"
        ],
        "estimated_calories": 620,
        "tags": [
          "外卖",
          "高碳水"
        ]
      },
      {
        "meal_type": "dinner",
        "time": "19:30",
        "foods": [
          "烤肉饭"
        ],
        "estimated_calories": 720,
        "tags": [
          "外卖",
          "高油"
        ]
      }
    ],
    "daily_calories": 1660,
    "water_ml": 692
  },
  {
    "date": "2026-01-11",
    "meals": [
      {
        "meal_type": "lunch",
        "time": "12:30",
        "foods": [
          "黄焖鸡米饭"
        ],
        "estimated_calories": 750,
        "tags": [
          "外卖",
          "高油",
          "高碳水"
        ]
      },
      {
        "meal_type": "dinner",
        "time": "20:00",
        "foods": [
          "便当",
          "关东煮"
        ],
        "estimated_calories": 520,
        "tags": [
          "便利店",
          "简单"
        ]
      }
    ],
    "daily_calories": 1270,
    "water_ml": 799
  },
  {
    "date": "2026-01-12",
    "meals": [
      {
        "meal_type": "breakfast",
        "time": "08:30",
        "foods": [
          "食堂馒头",
          "粥"
        ],
        "estimated_calories": 320,
        "tags": [
          "食堂",
          "简单"
        ]
      },
      {
        "meal_type": "lunch",
        "time": "12:00",
        "foods": [
          "螺蛳粉"
        ],
        "estimated_calories": 620,
        "tags": [
          "外卖",
          "高碳水"
        ]
      },
      {
        "meal_type": "dinner",
        "time": "20:00",
        "foods": [
          "泡面",
          "火腿肠"
        ],
        "estimated_calories": 550,
        "tags": [
          "便利店",
          "高碳水",
          "简单"
        ]
      },
      {
        "meal_type": "snack",
        "time": "23:00",
        "foods": [
          "奶茶"
        ],
        "estimated_calories": 300,
        "tags": [
          "外卖"
        ]
      }
    ],
    "daily_calories": 1790,
    "water_ml": 864
  },
  {
    "date": "2026-01-13",
    "meals": [
      {
        "meal_type": "lunch",
        "time": "12:30",
        "foods": [
          "麻辣烫"
        ],
        "estimated_calories": 680,
        "tags": [
          "外卖",
          "高油"
        ]
      },
      {
        "meal_type": "dinner",
        "time": "19:30",
        "foods": [
          "烤肉饭"
        ],
        "estimated_calories": 720,
        "tags": [
          "外卖",
          "高油"
        ]
      }
    ],
    "daily_calories": 1400,
    "water_ml": 709
  },
  {
    "date": "2026-01-14",
    "meals": [
      {
        "meal_type": "breakfast",
        "time": "08:30",
        "foods": [
          "包子",
          "豆浆"
        ],
        "estimated_calories": 350,
        "tags": [
          "路边摊",
          "高碳水"
        ]
      },
      {
        "meal_type": "lunch",
        "time": "13:00",
        "foods": [
          "米饭",
          "鸡腿",
          "青菜"
        ],
        "estimated_calories": 600,
        "tags": [
          "食堂",
          "简单"
        ]
      },
      {
        "meal_type": "dinner",
        "time": "21:00",
        "foods": [
          "泡面",
          "火腿肠"
        ],
        "estimated_calories": 550,
        "tags": [
          "便利店",
          "高碳水",
          "简单"
        ]